{
  "caso": "2026-10-16-sabatina-flavio-globo-2turno",
  "gerado_em": "2026-10-17",
  "fonte_alegacoes": "alegacoes/alegacoes-sabatina-completa.json",
  "checagens": [
    {
      "id": "A101",
      "veredito": "IMPRECISO",
      "resumo": "Vaccari foi preso em 2015 na Lava Jato, por corrupção ligada à Petrobras, não por fraude em fundos de pensão",
      "explicacao": "A frase tem duas partes: que Vaccari já foi preso, e que a prisão foi 'exatamente por fraude em fundos de pensão'. A primeira se confirma: o Congresso em Foco e a Exame (Estadão Conteúdo) registram que ele estava preso na Operação Lava Jato desde abril de 2015, com condenações por corrupção passiva, lavagem de dinheiro e organização criminosa, e o próprio TRF-4 descreve o crime como propina do grupo Keppel Fels aceita por funcionários da Petrobras. A segunda não: a Tribuna do Paraná (Estadão) mostra que, nos fundos de pensão, o nome de Vaccari apareceu na CPI da Câmara de 2016, convocado após citações em depoimentos (Youssef disse ter 'ouvido falar' que ele operava fundos como Petros e Funcef), sem prisão por isso; e o Estado de Minas (com Agência Brasil) registra que em maio de 2017 a Justiça Federal do DF aceitou denúncia da Operação Greenfield que tornou Vaccari réu por gestão fraudulenta e outros crimes ligados à Funcef, o fundo de pensão da Caixa. Ou seja, a acusação de fraude em fundo de pensão existe, mas como ação penal, não como motivo de prisão. Nas buscas feitas (inclusive a da revisão) não apareceu prisão de Vaccari por fraude em fundos de pensão. O essencial (já foi preso) está certo e o motivo está errado; pela árvore da METODOLOGIA §2.1, é IMPRECISO, e não FALSO, porque a prisão existiu. Confiança média porque a ausência de outra prisão foi inferida das fontes da Lava Jato, não de certidão. Não há checagem anterior deste dado nos casos de 15/out e 28/ago.",
      "numero_dito": null,
      "numero_apurado": null,
      "data_de_referencia": "prisão de abril de 2015 (Lava Jato); CPI dos Fundos de Pensão de 2016; denúncia da Greenfield aceita em maio de 2017",
      "ressalva": "A prisão foi pela Lava Jato; por fraude na Funcef, fundo de pensão da Caixa, ele virou réu em 2017 na Operação Greenfield",
      "confianca": "media",
      "divergencia_entre_fontes": null,
      "revisao_humana": null,
      "fontes": [
        {
          "nivel": "N4",
          "instituicao": "Congresso em Foco",
          "titulo": "Vaccari tem pena de prisão elevada de dez para 24 anos na Lava Jato (07/11/2017)",
          "url": "https://congressoemfoco.com.br/noticia/29032/vaccari-tem-pena-de-prisao-elevada-de-dez-para-24-anos-na-lava-jato",
          "consultada_em": "2026-10-17",
          "trecho": "“Vaccari, direta ou indiretamente, em unidade de desígnios e de modo consciente e voluntário, em razão de sua posição no núcleo político por ele integrado, solicitou, aceitou e recebeu para si e para o Partido dos Trabalhadores os valores espúrios oferecidos pelo Grupo Keppel Fels e aceitos também pelos funcionários da Petrobras, agindo assim como beneficiário da corrupção”, diz trecho do despacho.",
          "prova": "Mostra que a condenação mantida pelo TRF-4 é por corrupção ligada à Petrobras, não a fundos de pensão."
        },
        {
          "nivel": "N4",
          "instituicao": "Exame (Estadão Conteúdo)",
          "titulo": "Ex-tesoureiro do PT fica na cadeia da Lava Jato (05/07/2017)",
          "url": "https://exame.com/brasil/ex-tesoureiro-do-pt-fica-na-cadeia-da-lava-jato/",
          "consultada_em": "2026-10-17",
          "trecho": "O Tribunal Regional Federal da 4ª Região (TRF-4) negou liberdade para o ex-tesoureiro do PT João Vaccari Neto - preso na Operação Lava Jato desde abril de 2015.",
          "prova": "Data e operação da prisão: Lava Jato, abril de 2015."
        },
        {
          "nivel": "N4",
          "instituicao": "Tribuna do Paraná (Estadão Conteúdo)",
          "titulo": "Vaccari permanecerá calado em depoimento à CPI dos Fundos de Pensão (03/02/2016)",
          "url": "https://www.tribunapr.com.br/noticias/politica/vaccari-permanecera-calado-em-depoimento-a-cpi-dos-fundos-de-pensao/",
          "consultada_em": "2026-10-17",
          "trecho": "O ex-tesoureiro do PT está preso em Curitiba pelo seu envolvimento na Lava Jato. Ele já foi condenado em primeira instância a 15 anos e quatro meses de prisão pelos crimes de corrupção passiva, lavagem de dinheiro e associação criminosa. Além disso, terá de pagar multa de R$ 4,3 milhões. Na CPI dos Fundos de Pensão, Vaccari foi convocado após seu nome aparecer em depoimentos de pessoas envolvidas em suposta manipulação na gestão dessas instituições.",
          "prova": "Separa as duas frentes: preso pela Lava Jato; nos fundos de pensão, apenas convocado pela CPI após citações em depoimentos."
        },
        {
          "nivel": "N4",
          "instituicao": "Tribuna do Paraná (Estadão Conteúdo)",
          "titulo": "Justiça abre ação contra Vaccari, Renato Duque e 25 investigados na Lava Jato (23/03/2015)",
          "url": "https://www.tribunapr.com.br/noticias/politica/justica-abre-acao-contra-vaccari-renato-duque-e-25-investigados-na-lava-jato/",
          "consultada_em": "2026-10-17",
          "trecho": "A Justiça Federal no Paraná abriu ação penal contra o tesoureiro do PT João Vaccari Neto e o ex-diretor de Serviços da Petrobras, Renato Duque, por corrupção e lavagem de dinheiro.",
          "prova": "A primeira ação penal contra Vaccari, às vésperas da prisão, trata de corrupção na Petrobras."
        },
        {
          "nivel": "N4",
          "instituicao": "Estado de Minas (com Agência Brasil)",
          "titulo": "Vaccari e mais 13 ex-diretores da Funcef se tornam réus na Operação Greenfield (29/05/2017)",
          "url": "https://www.em.com.br/app/noticia/politica/2017/05/29/interna_politica,872596/vaccari-e-mais-13-ex-diretores-da-funcef-se-tornam-reus-na-operacao-gr.shtml",
          "consultada_em": "2026-10-17",
          "trecho": "postado em 29/05/2017 16:35 [...] A Justiça Federal do Distrito Federal aceitou nesta segunda-feira a primeira denúncia apresentada pelo Ministério Público Federal (MPF) no âmbito da Operação Greenfield. Ao todo, 14 indivíduos se tornaram réus, incluído o ex-tesoureiro do PT, João Vaccari Neto, e Guilherme Lacerda, ex-diretor-presidente da Fundação dos Economiários Federais (Funcef), fundo de pensão dos funcionários da Caixa Econômica Federal (Funcef). [...] Os envolvidos são acusados de crimes contra o sistema financeiro, gestão fraudulenta e temerária, lavagem de dinheiro e tráfico de influência.",
          "prova": "Vaccari virou réu por fraude num fundo de pensão (Funcef) em 2017, na Operação Greenfield; a fonte trata de ação penal, não de prisão por esse caso."
        }
      ]
    },
    {
      "id": "A102",
      "veredito": "INSUSTENTAVEL",
      "resumo": "Os 10% são relato de Vorcaro em delação rejeitada, sem comprovação; R$ 1 bi seria a comissão, não o valor a investir",
      "explicacao": "O que está documentado: a revista Veja publicou em 9/out/2026 relato atribuído a Daniel Vorcaro, num anexo de delação rejeitada, segundo o qual Vaccari teria exigido 10% de tudo o que o Banco Master captasse nos fundos de pensão das estatais (reprodução da Veja no TNH1; NC News e Jornal Correio como apoio, que também reproduzem a reportagem, o que se declara aqui). A PGR não deu andamento por falta de prova dos pagamentos, a PF disse não ter recebido material com esse conteúdo, e o caso está em apuração a partir de uma notícia-crime (etica-e-risco §5): por isso o veredito não pode ser VERDADEIRO nem FALSO e fica INSUSTENTAVEL. Há ainda um descompasso de número mesmo dentro do relato de Vorcaro: R$ 1 bilhão não era o valor que Vaccari ofereceria para investir no Master, mas a comissão projetada de 10% sobre até R$ 10 bilhões captados. Nada aqui afirma que a cobrança ocorreu ou não ocorreu.",
      "numero_dito": "R$ 1 bilhão oferecidos para investir e propina de 10%",
      "numero_apurado": "no relato de Vorcaro, 10% sobre o captado, com até R$ 1 bilhão de comissão sobre até R$ 10 bilhões; sem comprovação",
      "data_de_referencia": "relato atribuído a Vorcaro, divulgado em 9/out/2026",
      "ressalva": null,
      "confianca": "media",
      "divergencia_entre_fontes": "A Veja diz que mensagens no celular de Vorcaro ajudam a corroborar o relato; a PF diz não ter recebido depoimento nem anexos com esse conteúdo, e a PGR não viu prova dos pagamentos.",
      "revisao_humana": null,
      "fontes": [
        {
          "nivel": "N4",
          "instituicao": "TNH1 (reprodução da reportagem da revista Veja)",
          "titulo": "Vorcaro conta que liberou dinheiro para filme sobre Lula por negócios no governo (09/10/2026)",
          "url": "https://www.tnh1.com.br/noticia/nid/vorcaro-conta-que-liberou-dinheiro-para-filme-sobre-lula-por-negocios-no-governo/",
          "consultada_em": "2026-10-17",
          "trecho": "Além dessa primeira quantia, Vorcaro conta que Vaccari exigiu uma taxa de 10% de tudo o que o banco captasse junto aos fundos de previdência de servidores da Caixa, do Banco do Brasil, da Petrobras e dos Correios. Se tudo tivesse dado certo, o petismo embolsaria 1 bilhão de reais. Vorcaro, por sua vez, faturaria 9 bilhões de reais na mesma operação.",
          "prova": "É a origem do número: na versão de Vorcaro, R$ 1 bilhão seria a comissão de 10% sobre o que o banco captasse, e não o valor oferecido para investir."
        },
        {
          "nivel": "N4",
          "instituicao": "NC News",
          "titulo": "Vorcaro financiou filme de Lula com dinheiro ilegal? O que a PF diz sobre a denúncia (09/10/2026)",
          "url": "https://ncnews.com.br/?p=59915",
          "consultada_em": "2026-10-17",